Bluetooth monitor ver 5.43
= Note: Linux version 4.14.98+ (armv6l)                                0.696099
= Note: Bluetooth subsystem version 2.22                               0.696114
= New Index: B8:27:EB:C6:DB:91 (Primary,UART,hci0)              [hci0] 0.696118
= Open Index: B8:27:EB:C6:DB:91                                 [hci0] 0.696122
= Index Info: B8:27:EB:C6:DB:91 (Broadcom Corporation)          [hci0] 0.696126
@ MGMT Open: bluetoothd (privileged) version 1.14             {0x0001} 0.696132
@ MGMT Open: btmon (privileged) version 1.14                  {0x0002} 0.696262
> HCI Event: Connect Request (0x04) plen 10                    [hci0] 13.448584
        Address: D4:6D:6D:D9:B3:F3 (OUI D4-6D-6D)
        Class: 0x0c010c
          Major class: Computer (desktop, notebook, PDA, organizers)
          Minor class: Laptop
          Rendering (Printing, Speaker)
          Capturing (Scanner, Microphone)
        Link type: ACL (0x01)
< HCI Command: Accept Connection Request (0x01|0x0009) plen 7  [hci0] 13.448753
        Address: D4:6D:6D:D9:B3:F3 (OUI D4-6D-6D)
        Role: Master (0x00)
> HCI Event: Command Status (0x0f) plen 4                      [hci0] 13.452174
      Accept Connection Request (0x01|0x0009) ncmd 1
        Status: Success (0x00)
> HCI Event: Role Change (0x12) plen 8                         [hci0] 13.611073
        Status: Success (0x00)
        Address: D4:6D:6D:D9:B3:F3 (OUI D4-6D-6D)
        Role: Master (0x00)
> HCI Event: Connect Complete (0x03) plen 11                   [hci0] 13.639987
        Status: Success (0x00)
        Handle: 12
        Address: D4:6D:6D:D9:B3:F3 (OUI D4-6D-6D)
        Link type: ACL (0x01)
        Encryption: Disabled (0x00)
< HCI Command: Read Remote Supported F.. (0x01|0x001b) plen 2  [hci0] 13.640461
        Handle: 12
> HCI Event: Command Status (0x0f) plen 4                      [hci0] 13.650101
      Read Remote Supported Features (0x01|0x001b) ncmd 1
        Status: Success (0x00)
> HCI Event: Read Remote Supported Features (0x0b) plen 11     [hci0] 13.650228
        Status: Success (0x00)
        Handle: 12
        Features: 0xff 0xfe 0x0f 0xfe 0xdb 0xff 0x7b 0x87
          3 slot packets
          5 slot packets
          Encryption
          Slot offset
          Timing accuracy
          Role switch
          Hold mode
          Sniff mode
          Power control requests
          Channel quality driven data rate (CQDDR)
          SCO link
          HV2 packets
          HV3 packets
          u-law log synchronous data
          A-law log synchronous data
          CVSD synchronous data
          Paging parameter negotiation
          Power control
          Transparent synchronous data
          Enhanced Data Rate ACL 2 Mbps mode
          Enhanced Data Rate ACL 3 Mbps mode
          Enhanced inquiry scan
          Interlaced inquiry scan
          Interlaced page scan
          RSSI with inquiry results
          Extended SCO link (EV3 packets)
          EV4 packets
          EV5 packets
          AFH capable slave
          AFH classification slave
          LE Supported (Controller)
          3-slot Enhanced Data Rate ACL packets
          5-slot Enhanced Data Rate ACL packets
          Sniff subrating
          Pause encryption
          AFH capable master
          AFH classification master
          Enhanced Data Rate eSCO 2 Mbps mode
          Enhanced Data Rate eSCO 3 Mbps mode
          3-slot Enhanced Data Rate eSCO packets
          Extended Inquiry Response
          Simultaneous LE and BR/EDR (Controller)
          Secure Simple Pairing
          Encapsulated PDU
          Erroneous Data Reporting
          Non-flushable Packet Boundary Flag
          Link Supervision Timeout Changed Event
          Inquiry TX Power Level
          Enhanced Power Control
          Extended features
< HCI Command: Read Remote Extended Fe.. (0x01|0x001c) plen 3  [hci0] 13.650313
        Handle: 12
        Page: 1
> HCI Event: Command Status (0x0f) plen 4                      [hci0] 13.650919
      Read Remote Extended Features (0x01|0x001c) ncmd 1
        Status: Success (0x00)
> HCI Event: Read Remote Extended Features (0x23) plen 13      [hci0] 13.651175
        Status: Success (0x00)
        Handle: 12
        Page: 1/2
        Features: 0x0b 0x00 0x00 0x00 0x00 0x00 0x00 0x00
          Secure Simple Pairing (Host Support)
          LE Supported (Host)
          Secure Connections (Host Support)
< HCI Command: Remote Name Request (0x01|0x0019) plen 10       [hci0] 13.651334
        Address: D4:6D:6D:D9:B3:F3 (OUI D4-6D-6D)
        Page scan repetition mode: R2 (0x02)
        Page scan mode: Mandatory (0x00)
        Clock offset: 0x0000
< ACL Data TX: Handle 12 flags 0x00 dlen 10                    [hci0] 13.651378
      L2CAP: Information Request (0x0a) ident 1 len 2
        Type: Extended features supported (0x0002)
> HCI Event: Command Status (0x0f) plen 4                      [hci0] 13.652083
      Remote Name Request (0x01|0x0019) ncmd 1
        Status: Success (0x00)
> HCI Event: Max Slots Change (0x1b) plen 3                    [hci0] 13.656239
        Handle: 12
        Max slots: 5
> HCI Event: Page Scan Repetition Mode Change (0x20) plen 7    [hci0] 13.657438
        Address: D4:6D:6D:D9:B3:F3 (OUI D4-6D-6D)
        Page scan repetition mode: R1 (0x01)
> HCI Event: Remote Name Req Complete (0x07) plen 255          [hci0] 13.688360
        Status: Success (0x00)
        Address: D4:6D:6D:D9:B3:F3 (OUI D4-6D-6D)
        Name: alex-ibm
@ MGMT Event: Device Connected (0x000b) plen 28       {0x0002} [hci0] 13.688463
        BR/EDR Address: D4:6D:6D:D9:B3:F3 (OUI D4-6D-6D)
        Flags: 0x00000000
        Data length: 15
        Name (complete): alex-ibm
        Class: 0x0c010c
          Major class: Computer (desktop, notebook, PDA, organizers)
          Minor class: Laptop
          Rendering (Printing, Speaker)
          Capturing (Scanner, Microphone)
@ MGMT Event: Device Connected (0x000b) plen 28       {0x0001} [hci0] 13.688463
        BR/EDR Address: D4:6D:6D:D9:B3:F3 (OUI D4-6D-6D)
        Flags: 0x00000000
        Data length: 15
        Name (complete): alex-ibm
        Class: 0x0c010c
          Major class: Computer (desktop, notebook, PDA, organizers)
          Minor class: Laptop
          Rendering (Printing, Speaker)
          Capturing (Scanner, Microphone)
> HCI Event: IO Capability Response (0x32) plen 9              [hci0] 13.724025
        Address: D4:6D:6D:D9:B3:F3 (OUI D4-6D-6D)
        IO capability: NoInputNoOutput (0x03)
        OOB data: Authentication data not present (0x00)
        Authentication: No Bonding - MITM not required (0x00)
> HCI Event: IO Capability Request (0x31) plen 6               [hci0] 13.724060
        Address: D4:6D:6D:D9:B3:F3 (OUI D4-6D-6D)
< HCI Command: IO Capability Request R.. (0x01|0x002b) plen 9  [hci0] 13.724199
        Address: D4:6D:6D:D9:B3:F3 (OUI D4-6D-6D)
        IO capability: NoInputNoOutput (0x03)
        OOB data: Authentication data not present (0x00)
        Authentication: No Bonding - MITM not required (0x00)
> HCI Event: Command Complete (0x0e) plen 10                   [hci0] 13.724668
      IO Capability Request Reply (0x01|0x002b) ncmd 1
        Status: Success (0x00)
        Address: D4:6D:6D:D9:B3:F3 (OUI D4-6D-6D)
> HCI Event: Number of Completed Packets (0x13) plen 5         [hci0] 13.833413
        Num handles: 1
        Handle: 12
        Count: 1
> HCI Event: User Confirmation Request (0x33) plen 10          [hci0] 14.020664
        Address: D4:6D:6D:D9:B3:F3 (OUI D4-6D-6D)
        Passkey: 148373
< HCI Command: User Confirmation Reque.. (0x01|0x002c) plen 6  [hci0] 14.020795
        Address: D4:6D:6D:D9:B3:F3 (OUI D4-6D-6D)
> HCI Event: Command Complete (0x0e) plen 10                   [hci0] 14.022138
      User Confirmation Request Reply (0x01|0x002c) ncmd 1
        Status: Success (0x00)
        Address: D4:6D:6D:D9:B3:F3 (OUI D4-6D-6D)
> HCI Event: Simple Pairing Complete (0x36) plen 7             [hci0] 14.985125
        Status: Success (0x00)
        Address: D4:6D:6D:D9:B3:F3 (OUI D4-6D-6D)
> HCI Event: Link Key Notification (0x18) plen 23              [hci0] 15.024648
        Address: D4:6D:6D:D9:B3:F3 (OUI D4-6D-6D)
        Link key: f650d0077ff5d0a8aa5d6e8427b686bb
        Key type: Unauthenticated Combination key from P-256 (0x07)
@ MGMT Event: New Link Key (0x0009) plen 26           {0x0002} [hci0] 15.024773
        Store hint: No (0x00)
        BR/EDR Address: D4:6D:6D:D9:B3:F3 (OUI D4-6D-6D)
        Key type: Unauthenticated Combination key from P-256 (0x07)
        Link key: f650d0077ff5d0a8aa5d6e8427b686bb
        PIN length: 0
@ MGMT Event: New Link Key (0x0009) plen 26           {0x0001} [hci0] 15.024773
        Store hint: No (0x00)
        BR/EDR Address: D4:6D:6D:D9:B3:F3 (OUI D4-6D-6D)
        Key type: Unauthenticated Combination key from P-256 (0x07)
        Link key: f650d0077ff5d0a8aa5d6e8427b686bb
        PIN length: 0
> HCI Event: Encryption Change (0x08) plen 4                   [hci0] 15.047010
        Status: Success (0x00)
        Handle: 12
        Encryption: Enabled with AES-CCM (0x02)
< HCI Command: Read Encryption Key Size (0x05|0x0008) plen 2   [hci0] 15.047149
        Handle: 12
> HCI Event: Command Complete (0x0e) plen 7                    [hci0] 15.047604
      Read Encryption Key Size (0x05|0x0008) ncmd 1
        Status: Success (0x00)
        Handle: 12
        Key size: 16
> ACL Data RX: Handle 12 flags 0x02 dlen 10                    [hci0] 15.076159
      L2CAP: Information Request (0x0a) ident 1 len 2
        Type: Extended features supported (0x0002)
< ACL Data TX: Handle 12 flags 0x00 dlen 16                    [hci0] 15.076291
      L2CAP: Information Response (0x0b) ident 1 len 8
        Type: Extended features supported (0x0002)
        Result: Success (0x0000)
        Features: 0x000002b8
          Enhanced Retransmission Mode
          Streaming Mode
          FCS Option
          Fixed Channels
          Unicast Connectionless Data Reception
> ACL Data RX: Handle 12 flags 0x02 dlen 16                    [hci0] 15.077409
      L2CAP: Information Response (0x0b) ident 1 len 8
        Type: Extended features supported (0x0002)
        Result: Success (0x0000)
        Features: 0x000002b8
          Enhanced Retransmission Mode
          Streaming Mode
          FCS Option
          Fixed Channels
          Unicast Connectionless Data Reception
< ACL Data TX: Handle 12 flags 0x00 dlen 10                    [hci0] 15.077517
      L2CAP: Information Request (0x0a) ident 2 len 2
        Type: Fixed channels supported (0x0003)
> HCI Event: Number of Completed Packets (0x13) plen 5         [hci0] 15.079960
        Num handles: 1
        Handle: 12
        Count: 2
> ACL Data RX: Handle 12 flags 0x02 dlen 10                    [hci0] 15.081147
      L2CAP: Information Request (0x0a) ident 2 len 2
        Type: Fixed channels supported (0x0003)
< ACL Data TX: Handle 12 flags 0x00 dlen 20                    [hci0] 15.081253
      L2CAP: Information Response (0x0b) ident 2 len 12
        Type: Fixed channels supported (0x0003)
        Result: Success (0x0000)
        Channels: 0x0000000000000086
          L2CAP Signaling (BR/EDR)
          Connectionless reception
          Security Manager (BR/EDR)
> ACL Data RX: Handle 12 flags 0x02 dlen 20                    [hci0] 15.082424
      L2CAP: Information Response (0x0b) ident 2 len 12
        Type: Fixed channels supported (0x0003)
        Result: Success (0x0000)
        Channels: 0x0000000000000086
          L2CAP Signaling (BR/EDR)
          Connectionless reception
          Security Manager (BR/EDR)
> ACL Data RX: Handle 12 flags 0x02 dlen 12                    [hci0] 15.086165
      L2CAP: Connection Request (0x02) ident 3 len 4
        PSM: 3 (0x0003)
        Source CID: 64
< ACL Data TX: Handle 12 flags 0x00 dlen 16                    [hci0] 15.086372
      L2CAP: Connection Response (0x03) ident 3 len 8
        Destination CID: 64
        Source CID: 64
        Result: Connection successful (0x0000)
        Status: No further information available (0x0000)
< ACL Data TX: Handle 12 flags 0x00 dlen 27                    [hci0] 15.086408
      L2CAP: Configure Request (0x04) ident 3 len 19
        Destination CID: 64
        Flags: 0x0000
        Option: Maximum Transmission Unit (0x01) [mandatory]
          MTU: 1013
        Option: Retransmission and Flow Control (0x04) [mandatory]
          Mode: Basic (0x00)
          TX window size: 0
          Max transmit: 0
          Retransmission timeout: 0
          Monitor timeout: 0
          Maximum PDU size: 0
> HCI Event: Number of Completed Packets (0x13) plen 5         [hci0] 15.091230
        Num handles: 1
        Handle: 12
        Count: 2
> ACL Data RX: Handle 12 flags 0x02 dlen 27                    [hci0] 15.094937
      L2CAP: Configure Request (0x04) ident 4 len 19
        Destination CID: 64
        Flags: 0x0000
        Option: Maximum Transmission Unit (0x01) [mandatory]
          MTU: 1013
        Option: Retransmission and Flow Control (0x04) [mandatory]
          Mode: Basic (0x00)
          TX window size: 0
          Max transmit: 0
          Retransmission timeout: 0
          Monitor timeout: 0
          Maximum PDU size: 0
< ACL Data TX: Handle 12 flags 0x00 dlen 18                    [hci0] 15.095063
      L2CAP: Configure Response (0x05) ident 4 len 10
        Source CID: 64
        Flags: 0x0000
        Result: Success (0x0000)
        Option: Maximum Transmission Unit (0x01) [mandatory]
          MTU: 1013
> ACL Data RX: Handle 12 flags 0x02 dlen 18                    [hci0] 15.096180
      L2CAP: Configure Response (0x05) ident 3 len 10
        Source CID: 64
        Flags: 0x0000
        Result: Success (0x0000)
        Option: Maximum Transmission Unit (0x01) [mandatory]
          MTU: 1013
> HCI Event: Number of Completed Packets (0x13) plen 5         [hci0] 15.098734
        Num handles: 1
        Handle: 12
        Count: 2
> ACL Data RX: Handle 12 flags 0x02 dlen 8                     [hci0] 15.101177
      Channel: 64 len 4 [PSM 3 mode 0] {chan 0}
      RFCOMM: Set Async Balance Mode (SABM) (0x2f)
         Address: 0x03 cr 1 dlci 0x00
         Control: 0x3f poll/final 1
         Length: 0
         FCS: 0x1c
< ACL Data TX: Handle 12 flags 0x00 dlen 8                     [hci0] 15.101436
      Channel: 64 len 4 [PSM 3 mode 0] {chan 0}
      RFCOMM: Unnumbered Ack (UA) (0x63)
         Address: 0x03 cr 1 dlci 0x00
         Control: 0x73 poll/final 1
         Length: 0
         FCS: 0xd7
> ACL Data RX: Handle 12 flags 0x02 dlen 18                    [hci0] 15.128704
      Channel: 64 len 14 [PSM 3 mode 0] {chan 0}
      RFCOMM: Unnumbered Info with Header Check (UIH) (0xef)
         Address: 0x03 cr 1 dlci 0x00
         Control: 0xef poll/final 0
         Length: 10
         FCS: 0x70
         MCC Message type: DLC Parameter Negotiation CMD (0x20)
           Length: 8
           dlci 2 frame_type 0 credit_flow 15 pri 7
           ack_timer 0 frame_size 1008 max_retrans 0 credits 7
< ACL Data TX: Handle 12 flags 0x00 dlen 18                    [hci0] 15.128950
      Channel: 64 len 14 [PSM 3 mode 0] {chan 0}
      RFCOMM: Unnumbered Info with Header Check (UIH) (0xef)
         Address: 0x01 cr 0 dlci 0x00
         Control: 0xef poll/final 0
         Length: 10
         FCS: 0xaa
         MCC Message type: DLC Parameter Negotiation RSP (0x20)
           Length: 8
           dlci 2 frame_type 0 credit_flow 14 pri 7
           ack_timer 0 frame_size 1008 max_retrans 0 credits 7
> HCI Event: Number of Completed Packets (0x13) plen 5         [hci0] 15.132469
        Num handles: 1
        Handle: 12
        Count: 2
> ACL Data RX: Handle 12 flags 0x02 dlen 8                     [hci0] 15.136132
      Channel: 64 len 4 [PSM 3 mode 0] {chan 0}
      RFCOMM: Set Async Balance Mode (SABM) (0x2f)
         Address: 0x0b cr 1 dlci 0x02
         Control: 0x3f poll/final 1
         Length: 0
         FCS: 0x59
< ACL Data TX: Handle 12 flags 0x00 dlen 8                     [hci0] 15.137782
      Channel: 64 len 4 [PSM 3 mode 0] {chan 0}
      RFCOMM: Unnumbered Ack (UA) (0x63)
         Address: 0x0b cr 1 dlci 0x02
         Control: 0x73 poll/final 1
         Length: 0
         FCS: 0x92
< ACL Data TX: Handle 12 flags 0x00 dlen 12                    [hci0] 15.137847
      Channel: 64 len 8 [PSM 3 mode 0] {chan 0}
      RFCOMM: Unnumbered Info with Header Check (UIH) (0xef)
         Address: 0x01 cr 0 dlci 0x00
         Control: 0xef poll/final 0
         Length: 4
         FCS: 0xaa
         MCC Message type: Modem Status Command CMD (0x38)
           Length: 2
           dlci 2 
           fc 0 rtc 1 rtr 1 ic 0 dv 1
> HCI Event: Number of Completed Packets (0x13) plen 5         [hci0] 15.142476
        Num handles: 1
        Handle: 12
        Count: 2
> ACL Data RX: Handle 12 flags 0x02 dlen 12                    [hci0] 15.144893
      Channel: 64 len 8 [PSM 3 mode 0] {chan 0}
      RFCOMM: Unnumbered Info with Header Check (UIH) (0xef)
         Address: 0x03 cr 1 dlci 0x00
         Control: 0xef poll/final 0
         Length: 4
         FCS: 0x70
         MCC Message type: Modem Status Command CMD (0x38)
           Length: 2
           dlci 2 
           fc 0 rtc 1 rtr 1 ic 0 dv 1
< ACL Data TX: Handle 12 flags 0x00 dlen 12                    [hci0] 15.145082
      Channel: 64 len 8 [PSM 3 mode 0] {chan 0}
      RFCOMM: Unnumbered Info with Header Check (UIH) (0xef)
         Address: 0x01 cr 0 dlci 0x00
         Control: 0xef poll/final 0
         Length: 4
         FCS: 0xaa
         MCC Message type: Modem Status Command RSP (0x38)
           Length: 2
           dlci 2 
           fc 0 rtc 1 rtr 1 ic 0 dv 1
> ACL Data RX: Handle 12 flags 0x02 dlen 12                    [hci0] 15.146158
      Channel: 64 len 8 [PSM 3 mode 0] {chan 0}
      RFCOMM: Unnumbered Info with Header Check (UIH) (0xef)
         Address: 0x03 cr 1 dlci 0x00
         Control: 0xef poll/final 0
         Length: 4
         FCS: 0x70
         MCC Message type: Modem Status Command RSP (0x38)
           Length: 2
           dlci 2 
           fc 0 rtc 1 rtr 1 ic 0 dv 1
< ACL Data TX: Handle 12 flags 0x00 dlen 9                     [hci0] 15.146335
      Channel: 64 len 5 [PSM 3 mode 0] {chan 0}
      RFCOMM: Unnumbered Info with Header Check (UIH) (0xef)
         Address: 0x09 cr 0 dlci 0x02
         Control: 0xff poll/final 1
         Length: 0
         FCS: 0x5c
         Credits: 33
        5c                                               \               
> HCI Event: Number of Completed Packets (0x13) plen 5         [hci0] 15.150002
        Num handles: 1
        Handle: 12
        Count: 2
> ACL Data RX: Handle 12 flags 0x02 dlen 9                     [hci0] 15.151138
      Channel: 64 len 5 [PSM 3 mode 0] {chan 0}
      RFCOMM: Unnumbered Info with Header Check (UIH) (0xef)
         Address: 0x0b cr 1 dlci 0x02
         Control: 0xff poll/final 1
         Length: 0
         FCS: 0x86
         Credits: 33
        86                                               .               
> ACL Data RX: Handle 12 flags 0x02 dlen 24                    [hci0] 15.152420
      Channel: 64 len 20 [PSM 3 mode 0] {chan 0}
      RFCOMM: Unnumbered Info with Header Check (UIH) (0xef)
         Address: 0x0b cr 1 dlci 0x02
         Control: 0xef poll/final 0
         Length: 16
         FCS: 0x9a
        71 77 65 72 74 79 20 68 69 20 52 46 43 4f 4d 4d  qwerty hi RFCOMM
        9a                                               .               
< ACL Data TX: Handle 12 flags 0x00 dlen 8                     [hci0] 15.152994
      Channel: 64 len 4 [PSM 3 mode 0] {chan 0}
      RFCOMM: Disconnect (DISC) (0x43)
         Address: 0x09 cr 0 dlci 0x02
         Control: 0x53 poll/final 1
         Length: 0
         FCS: 0xd9
> ACL Data RX: Handle 12 flags 0x02 dlen 8                     [hci0] 15.153912
      Channel: 64 len 4 [PSM 3 mode 0] {chan 0}
      RFCOMM: Disconnect (DISC) (0x43)
         Address: 0x0b cr 1 dlci 0x02
         Control: 0x53 poll/final 1
         Length: 0
         FCS: 0xb8
< ACL Data TX: Handle 12 flags 0x00 dlen 8                     [hci0] 15.154108
      Channel: 64 len 4 [PSM 3 mode 0] {chan 0}
      RFCOMM: Unnumbered Ack (UA) (0x63)
         Address: 0x0b cr 1 dlci 0x02
         Control: 0x73 poll/final 1
         Length: 0
         FCS: 0x92
> HCI Event: Number of Completed Packets (0x13) plen 5         [hci0] 15.178790
        Num handles: 1
        Handle: 12
        Count: 2
> ACL Data RX: Handle 12 flags 0x02 dlen 8                     [hci0] 15.181175
      Channel: 64 len 4 [PSM 3 mode 0] {chan 0}
      RFCOMM: Unnumbered Ack (UA) (0x63)
         Address: 0x09 cr 0 dlci 0x02
         Control: 0x73 poll/final 1
         Length: 0
         FCS: 0xf3
< ACL Data TX: Handle 12 flags 0x00 dlen 8                     [hci0] 15.181724
      Channel: 64 len 4 [PSM 3 mode 0] {chan 0}
      RFCOMM: Disconnect Mode (DM) (0x0f)
         Address: 0x0b cr 1 dlci 0x02
         Control: 0x1f poll/final 1
         Length: 0
         FCS: 0x73
> ACL Data RX: Handle 12 flags 0x02 dlen 8                     [hci0] 15.182388
      Channel: 64 len 4 [PSM 3 mode 0] {chan 0}
      RFCOMM: Disconnect Mode (DM) (0x0f)
         Address: 0x09 cr 0 dlci 0x02
         Control: 0x1f poll/final 1
         Length: 0
         FCS: 0x12
> HCI Event: Number of Completed Packets (0x13) plen 5         [hci0] 15.333413
        Num handles: 1
        Handle: 12
        Count: 1
> ACL Data RX: Handle 12 flags 0x02 dlen 12                    [hci0] 16.092438
      L2CAP: Connection Request (0x02) ident 5 len 4
        PSM: 1 (0x0001)
        Source CID: 65
< ACL Data TX: Handle 12 flags 0x00 dlen 16                    [hci0] 16.092670
      L2CAP: Connection Response (0x03) ident 5 len 8
        Destination CID: 65
        Source CID: 65
        Result: Connection successful (0x0000)
        Status: No further information available (0x0000)
< ACL Data TX: Handle 12 flags 0x00 dlen 23                    [hci0] 16.092705
      L2CAP: Configure Request (0x04) ident 4 len 15
        Destination CID: 65
        Flags: 0x0000
        Option: Retransmission and Flow Control (0x04) [mandatory]
          Mode: Basic (0x00)
          TX window size: 0
          Max transmit: 0
          Retransmission timeout: 0
          Monitor timeout: 0
          Maximum PDU size: 0
> HCI Event: Number of Completed Packets (0x13) plen 5         [hci0] 16.097468
        Num handles: 1
        Handle: 12
        Count: 2
> ACL Data RX: Handle 12 flags 0x02 dlen 23                    [hci0] 16.098689
      L2CAP: Configure Request (0x04) ident 6 len 15
        Destination CID: 65
        Flags: 0x0000
        Option: Retransmission and Flow Control (0x04) [mandatory]
          Mode: Basic (0x00)
          TX window size: 0
          Max transmit: 0
          Retransmission timeout: 0
          Monitor timeout: 0
          Maximum PDU size: 0
< ACL Data TX: Handle 12 flags 0x00 dlen 18                    [hci0] 16.098798
      L2CAP: Configure Response (0x05) ident 6 len 10
        Source CID: 65
        Flags: 0x0000
        Result: Success (0x0000)
        Option: Maximum Transmission Unit (0x01) [mandatory]
          MTU: 672
> ACL Data RX: Handle 12 flags 0x02 dlen 18                    [hci0] 16.099951
      L2CAP: Configure Response (0x05) ident 4 len 10
        Source CID: 65
        Flags: 0x0000
        Result: Success (0x0000)
        Option: Maximum Transmission Unit (0x01) [mandatory]
          MTU: 672
> ACL Data RX: Handle 12 flags 0x02 dlen 24                    [hci0] 16.103733
      Channel: 65 len 20 [PSM 1 mode 0] {chan 1}
      SDP: Service Search Attribute Request (0x06) tid 0 len 15
        Search pattern: [len 5]
          Sequence (6) with 3 bytes [8 extra bits] len 5
            UUID (3) with 2 bytes [0 extra bits] len 3
              L2CAP (0x0100)
        Max record count: 65535
        Attribute list: [len 7]
          Sequence (6) with 5 bytes [8 extra bits] len 7
            Unsigned Integer (1) with 4 bytes [0 extra bits] len 5
              0x0000ffff
        Continuation state: 0
< ACL Data TX: Handle 12 flags 0x00 dlen 676                   [hci0] 16.105277
      Channel: 65 len 672 [PSM 1 mode 0] {chan 1}
      SDP: Service Search Attribute Response (0x07) tid 0 len 667
        Attribute bytes: 656
        Continuation state: 8
        26 3f d2 5c 90 02 00 00                          &?.\....        
> HCI Event: Number of Completed Packets (0x13) plen 5         [hci0] 16.113734
        Num handles: 1
        Handle: 12
        Count: 2
> ACL Data RX: Handle 12 flags 0x02 dlen 32                    [hci0] 16.117488
      Channel: 65 len 28 [PSM 1 mode 0] {chan 1}
      SDP: Service Search Attribute Request (0x06) tid 1 len 23
        Search pattern: [len 5]
          Sequence (6) with 3 bytes [8 extra bits] len 5
            UUID (3) with 2 bytes [0 extra bits] len 3
              L2CAP (0x0100)
        Max record count: 65535
        Attribute list: [len 7]
          Sequence (6) with 5 bytes [8 extra bits] len 7
            Unsigned Integer (1) with 4 bytes [0 extra bits] len 5
              0x0000ffff
        Continuation state: 8
        26 3f d2 5c 90 02 00 00                          &?.\....        
< ACL Data TX: Handle 12 flags 0x00 dlen 169                   [hci0] 16.118119
      Channel: 65 len 165 [PSM 1 mode 0] {chan 1}
      SDP: Service Search Attribute Response (0x07) tid 1 len 160
        Attribute bytes: 157
        Continuation state: 0
        Combined attribute bytes: 813
          Attribute list: [len 163] {position 0}
            Attribute: Service Record Handle (0x0000) [len 2]
              0x00010001
            Attribute: Service Class ID List (0x0001) [len 2]
              UUID (3) with 2 bytes [0 extra bits] len 3
                Generic Access Profile (0x1800)
            Attribute: Protocol Descriptor List (0x0004) [len 2]
              Sequence (6) with 6 bytes [8 extra bits] len 8
                UUID (3) with 2 bytes [0 extra bits] len 3
                  L2CAP (0x0100)
                Unsigned Integer (1) with 2 bytes [0 extra bits] len 3
                  0x001f
              Sequence (6) with 9 bytes [8 extra bits] len 11
                UUID (3) with 2 bytes [0 extra bits] len 3
                  ATT (0x0007)
                Unsigned Integer (1) with 2 bytes [0 extra bits] len 3
                  0x0001
                Unsigned Integer (1) with 2 bytes [0 extra bits] len 3
                  0x0005
            Attribute: Browse Group List (0x0005) [len 2]
              UUID (3) with 2 bytes [0 extra bits] len 3
                Public Browse Root (0x1002)
            Attribute: Documentation URL (0x000a) [len 2]
              http://www.bluez.org/ [len 21]
            Attribute: Client Executable URL (0x000b) [len 2]
              http://www.bluez.org/ [len 21]
            Attribute: Icon URL (0x000c) [len 2]
              http://www.bluez.org/ [len 21]
            Attribute: Unknown (0x0100) [len 2]
              Generic Access Profile [len 22]
            Attribute: Unknown (0x0102) [len 2]
              BlueZ [len 5]
          Attribute list: [len 88] {position 1}
            Attribute: Service Record Handle (0x0000) [len 2]
              0x00010002
            Attribute: Service Class ID List (0x0001) [len 2]
              UUID (3) with 2 bytes [0 extra bits] len 3
                Generic Attribute Profile (0x1801)
            Attribute: Protocol Descriptor List (0x0004) [len 2]
              Sequence (6) with 6 bytes [8 extra bits] len 8
                UUID (3) with 2 bytes [0 extra bits] len 3
                  L2CAP (0x0100)
                Unsigned Integer (1) with 2 bytes [0 extra bits] len 3
                  0x001f
              Sequence (6) with 9 bytes [8 extra bits] len 11
                UUID (3) with 2 bytes [0 extra bits] len 3
                  ATT (0x0007)
                Unsigned Integer (1) with 2 bytes [0 extra bits] len 3
                  0x0006
                Unsigned Integer (1) with 2 bytes [0 extra bits] len 3
                  0x0009
            Attribute: Browse Group List (0x0005) [len 2]
              UUID (3) with 2 bytes [0 extra bits] len 3
                Public Browse Root (0x1002)
            Attribute: Unknown (0x0100) [len 2]
              Generic Attribute Profile [len 25]
            Attribute: Unknown (0x0102) [len 2]
              BlueZ [len 5]
          Attribute list: [len 103] {position 2}
            Attribute: Service Record Handle (0x0000) [len 2]
              0x00010003
            Attribute: Service Class ID List (0x0001) [len 2]
              UUID (3) with 2 bytes [0 extra bits] len 3
                A/V Remote Control (0x110e)
              UUID (3) with 2 bytes [0 extra bits] len 3
                A/V Remote Control Controller (0x110f)
            Attribute: Protocol Descriptor List (0x0004) [len 2]
              Sequence (6) with 6 bytes [8 extra bits] len 8
                UUID (3) with 2 bytes [0 extra bits] len 3
                  L2CAP (0x0100)
                Unsigned Integer (1) with 2 bytes [0 extra bits] len 3
                  0x0017
              Sequence (6) with 6 bytes [8 extra bits] len 8
                UUID (3) with 2 bytes [0 extra bits] len 3
                  AVCTP (0x0017)
                Unsigned Integer (1) with 2 bytes [0 extra bits] len 3
                  0x0103
            Attribute: Browse Group List (0x0005) [len 2]
              UUID (3) with 2 bytes [0 extra bits] len 3
                Public Browse Root (0x1002)
            Attribute: Bluetooth Profile Descriptor List (0x0009) [len 2]
              Sequence (6) with 6 bytes [8 extra bits] len 8
                UUID (3) with 2 bytes [0 extra bits] len 3
                  A/V Remote Control (0x110e)
                Unsigned Integer (1) with 2 bytes [0 extra bits] len 3
                  0x0106
            Attribute: Additional Protocol Descriptor List (0x000d) [len 2]
              Sequence (6) with 16 bytes [8 extra bits] len 18
                Sequence (6) with 6 bytes [8 extra bits] len 8
                  UUID (3) with 2 bytes [0 extra bits] len 3
                    L2CAP (0x0100)
                  Unsigned Integer (1) with 2 bytes [0 extra bits] len 3
                    0x001b
                Sequence (6) with 6 bytes [8 extra bits] len 8
                  UUID (3) with 2 bytes [0 extra bits] len 3
                    AVCTP (0x0017)
                  Unsigned Integer (1) with 2 bytes [0 extra bits] len 3
                    0x0103
            Attribute: Unknown (0x0100) [len 2]
              AVRCP CT [len 8]
            Attribute: Unknown (0x0311) [len 2]
              0x004f
          Attribute list: [len 100] {position 3}
            Attribute: Service Record Handle (0x0000) [len 2]
              0x00010004
            Attribute: Service Class ID List (0x0001) [len 2]
              UUID (3) with 2 bytes [0 extra bits] len 3
                A/V Remote Control Target (0x110c)
            Attribute: Protocol Descriptor List (0x0004) [len 2]
              Sequence (6) with 6 bytes [8 extra bits] len 8
                UUID (3) with 2 bytes [0 extra bits] len 3
                  L2CAP (0x0100)
                Unsigned Integer (1) with 2 bytes [0 extra bits] len 3
                  0x0017
              Sequence (6) with 6 bytes [8 extra bits] len 8
                UUID (3) with 2 bytes [0 extra bits] len 3
                  AVCTP (0x0017)
                Unsigned Integer (1) with 2 bytes [0 extra bits] len 3
                  0x0103
            Attribute: Browse Group List (0x0005) [len 2]
              UUID (3) with 2 bytes [0 extra bits] len 3
                Public Browse Root (0x1002)
            Attribute: Bluetooth Profile Descriptor List (0x0009) [len 2]
              Sequence (6) with 6 bytes [8 extra bits] len 8
                UUID (3) with 2 bytes [0 extra bits] len 3
                  A/V Remote Control (0x110e)
                Unsigned Integer (1) with 2 bytes [0 extra bits] len 3
                  0x0105
            Attribute: Additional Protocol Descriptor List (0x000d) [len 2]
              Sequence (6) with 16 bytes [8 extra bits] len 18
                Sequence (6) with 6 bytes [8 extra bits] len 8
                  UUID (3) with 2 bytes [0 extra bits] len 3
                    L2CAP (0x0100)
                  Unsigned Integer (1) with 2 bytes [0 extra bits] len 3
                    0x001b
                Sequence (6) with 6 bytes [8 extra bits] len 8
                  UUID (3) with 2 bytes [0 extra bits] len 3
                    AVCTP (0x0017)
                  Unsigned Integer (1) with 2 bytes [0 extra bits] len 3
                    0x0103
            Attribute: Unknown (0x0100) [len 2]
              AVRCP TG [len 8]
            Attribute: Unknown (0x0311) [len 2]
              0x005f
          Attribute list: [len 81] {position 4}
            Attribute: Service Record Handle (0x0000) [len 2]
              0x00010005
            Attribute: Service Class ID List (0x0001) [len 2]
              UUID (3) with 2 bytes [0 extra bits] len 3
                Audio Source (0x110a)
            Attribute: Protocol Descriptor List (0x0004) [len 2]
              Sequence (6) with 6 bytes [8 extra bits] len 8
                UUID (3) with 2 bytes [0 extra bits] len 3
                  L2CAP (0x0100)
                Unsigned Integer (1) with 2 bytes [0 extra bits] len 3
                  0x0019
              Sequence (6) with 6 bytes [8 extra bits] len 8
                UUID (3) with 2 bytes [0 extra bits] len 3
                  AVDTP (0x0019)
                Unsigned Integer (1) with 2 bytes [0 extra bits] len 3
                  0x0103
            Attribute: Browse Group List (0x0005) [len 2]
              UUID (3) with 2 bytes [0 extra bits] len 3
                Public Browse Root (0x1002)
            Attribute: Bluetooth Profile Descriptor List (0x0009) [len 2]
              Sequence (6) with 6 bytes [8 extra bits] len 8
                UUID (3) with 2 bytes [0 extra bits] len 3
                  Advanced Audio Distribution (0x110d)
                Unsigned Integer (1) with 2 bytes [0 extra bits] len 3
                  0x0103
            Attribute: Unknown (0x0100) [len 2]
              Audio Source [len 12]
            Attribute: Unknown (0x0311) [len 2]
              0x000f
          Attribute list: [len 83] {position 5}
            Attribute: Service Record Handle (0x0000) [len 2]
              0x00010006
            Attribute: Service Class ID List (0x0001) [len 2]
              UUID (3) with 2 bytes [0 extra bits] len 3
                Headset AG (0x1112)
              UUID (3) with 2 bytes [0 extra bits] len 3
                Generic Audio (0x1203)
            Attribute: Protocol Descriptor List (0x0004) [len 2]
              Sequence (6) with 3 bytes [8 extra bits] len 5
                UUID (3) with 2 bytes [0 extra bits] len 3
                  L2CAP (0x0100)
              Sequence (6) with 5 bytes [8 extra bits] len 7
                UUID (3) with 2 bytes [0 extra bits] len 3
                  RFCOMM (0x0003)
                Unsigned Integer (1) with 1 byte [0 extra bits] len 2
                  0x0c
            Attribute: Browse Group List (0x0005) [len 2]
              UUID (3) with 2 bytes [0 extra bits] len 3
                Public Browse Root (0x1002)
            Attribute: Bluetooth Profile Descriptor List (0x0009) [len 2]
              Sequence (6) with 6 bytes [8 extra bits] len 8
                UUID (3) with 2 bytes [0 extra bits] len 3
                  Headset (0x1108)
                Unsigned Integer (1) with 2 bytes [0 extra bits] len 3
                  0x0102
            Attribute: Unknown (0x0100) [len 2]
              Headset Voice gateway [len 21]
          Attribute list: [len 97] {position 6}
            Attribute: Service Record Handle (0x0000) [len 2]
              0x00010007
            Attribute: Service Class ID List (0x0001) [len 2]
              UUID (3) with 2 bytes [0 extra bits] len 3
                Handsfree Audio Gateway (0x111f)
              UUID (3) with 2 bytes [0 extra bits] len 3
                Generic Audio (0x1203)
            Attribute: Protocol Descriptor List (0x0004) [len 2]
              Sequence (6) with 3 bytes [8 extra bits] len 5
                UUID (3) with 2 bytes [0 extra bits] len 3
                  L2CAP (0x0100)
              Sequence (6) with 5 bytes [8 extra bits] len 7
                UUID (3) with 2 bytes [0 extra bits] len 3
                  RFCOMM (0x0003)
                Unsigned Integer (1) with 1 byte [0 extra bits] len 2
                  0x0d
            Attribute: Browse Group List (0x0005) [len 2]
              UUID (3) with 2 bytes [0 extra bits] len 3
                Public Browse Root (0x1002)
            Attribute: Bluetooth Profile Descriptor List (0x0009) [len 2]
              Sequence (6) with 6 bytes [8 extra bits] len 8
                UUID (3) with 2 bytes [0 extra bits] len 3
                  Handsfree (0x111e)
                Unsigned Integer (1) with 2 bytes [0 extra bits] len 3
                  0x0107
            Attribute: Unknown (0x0100) [len 2]
              Hands-Free Voice gateway [len 24]
            Attribute: Unknown (0x0301) [len 2]
              0x01
            Attribute: Unknown (0x0311) [len 2]
              0x0000
          Attribute list: [len 79] {position 7}
            Attribute: Service Record Handle (0x0000) [len 2]
              0x00010008
            Attribute: Service Class ID List (0x0001) [len 2]
              UUID (3) with 2 bytes [0 extra bits] len 3
                Audio Sink (0x110b)
            Attribute: Protocol Descriptor List (0x0004) [len 2]
              Sequence (6) with 6 bytes [8 extra bits] len 8
                UUID (3) with 2 bytes [0 extra bits] len 3
                  L2CAP (0x0100)
                Unsigned Integer (1) with 2 bytes [0 extra bits] len 3
                  0x0019
              Sequence (6) with 6 bytes [8 extra bits] len 8
                UUID (3) with 2 bytes [0 extra bits] len 3
                  AVDTP (0x0019)
                Unsigned Integer (1) with 2 bytes [0 extra bits] len 3
                  0x0103
            Attribute: Browse Group List (0x0005) [len 2]
              UUID (3) with 2 bytes [0 extra bits] len 3
                Public Browse Root (0x1002)
            Attribute: Bluetooth Profile Descriptor List (0x0009) [len 2]
              Sequence (6) with 6 bytes [8 extra bits] len 8
                UUID (3) with 2 bytes [0 extra bits] len 3
                  Advanced Audio Distribution (0x110d)
                Unsigned Integer (1) with 2 bytes [0 extra bits] len 3
                  0x0103
            Attribute: Unknown (0x0100) [len 2]
              Audio Sink [len 10]
            Attribute: Unknown (0x0311) [len 2]
              0x000f
< ACL Data TX: Handle 12 flags 0x00 dlen 12                    [hci0] 16.130838
      L2CAP: Connection Request (0x02) ident 5 len 4
        PSM: 1 (0x0001)
        Source CID: 66
> HCI Event: Number of Completed Packets (0x13) plen 5         [hci0] 16.141242
        Num handles: 1
        Handle: 12
        Count: 2
> ACL Data RX: Handle 12 flags 0x02 dlen 16                    [hci0] 16.143659
      L2CAP: Connection Response (0x03) ident 5 len 8
        Destination CID: 66
        Source CID: 66
        Result: Connection successful (0x0000)
        Status: No further information available (0x0000)
< ACL Data TX: Handle 12 flags 0x00 dlen 23                    [hci0] 16.143785
      L2CAP: Configure Request (0x04) ident 6 len 15
        Destination CID: 66
        Flags: 0x0000
        Option: Retransmission and Flow Control (0x04) [mandatory]
          Mode: Basic (0x00)
          TX window size: 0
          Max transmit: 0
          Retransmission timeout: 0
          Monitor timeout: 0
          Maximum PDU size: 0
> ACL Data RX: Handle 12 flags 0x02 dlen 23                    [hci0] 16.144938
      L2CAP: Configure Request (0x04) ident 7 len 15
        Destination CID: 66
        Flags: 0x0000
        Option: Retransmission and Flow Control (0x04) [mandatory]
          Mode: Basic (0x00)
          TX window size: 0
          Max transmit: 0
          Retransmission timeout: 0
          Monitor timeout: 0
          Maximum PDU size: 0
< ACL Data TX: Handle 12 flags 0x00 dlen 18                    [hci0] 16.145056
      L2CAP: Configure Response (0x05) ident 7 len 10
        Source CID: 66
        Flags: 0x0000
        Result: Success (0x0000)
        Option: Maximum Transmission Unit (0x01) [mandatory]
          MTU: 672
> HCI Event: Number of Completed Packets (0x13) plen 5         [hci0] 16.147483
        Num handles: 1
        Handle: 12
        Count: 2
> ACL Data RX: Handle 12 flags 0x02 dlen 18                    [hci0] 16.148674
      L2CAP: Configure Response (0x05) ident 6 len 10
        Source CID: 66
        Flags: 0x0000
        Result: Success (0x0000)
        Option: Maximum Transmission Unit (0x01) [mandatory]
          MTU: 672
< ACL Data TX: Handle 12 flags 0x00 dlen 24                    [hci0] 16.149103
      Channel: 66 len 20 [PSM 1 mode 0] {chan 2}
      SDP: Service Search Attribute Request (0x06) tid 0 len 15
        Search pattern: [len 5]
          Sequence (6) with 3 bytes [8 extra bits] len 5
            UUID (3) with 2 bytes [0 extra bits] len 3
              L2CAP (0x0100)
        Max record count: 65535
        Attribute list: [len 7]
          Sequence (6) with 5 bytes [8 extra bits] len 7
            Unsigned Integer (1) with 4 bytes [0 extra bits] len 5
              0x0000ffff
        Continuation state: 0
> ACL Data RX: Handle 12 flags 0x02 dlen 24                    [hci0] 16.157458
      Channel: 65 len 20 [PSM 1 mode 0] {chan 1}
      SDP: Service Search Attribute Request (0x06) tid 2 len 15
        Search pattern: [len 5]
          Sequence (6) with 3 bytes [8 extra bits] len 5
            UUID (3) with 2 bytes [0 extra bits] len 3
              PnP Information (0x1200)
        Max record count: 65535
        Attribute list: [len 7]
          Sequence (6) with 5 bytes [8 extra bits] len 7
            Unsigned Integer (1) with 4 bytes [0 extra bits] len 5
              0x0000ffff
        Continuation state: 0
< ACL Data TX: Handle 12 flags 0x00 dlen 88                    [hci0] 16.158334
      Channel: 65 len 84 [PSM 1 mode 0] {chan 1}
      SDP: Service Search Attribute Response (0x07) tid 2 len 79
        Attribute bytes: 76
          Attribute list: [len 72] {position 0}
            Attribute: Service Record Handle (0x0000) [len 2]
              0x00010000
            Attribute: Service Class ID List (0x0001) [len 2]
              UUID (3) with 2 bytes [0 extra bits] len 3
                PnP Information (0x1200)
            Attribute: Browse Group List (0x0005) [len 2]
              UUID (3) with 2 bytes [0 extra bits] len 3
                Public Browse Root (0x1002)
            Attribute: Bluetooth Profile Descriptor List (0x0009) [len 2]
              Sequence (6) with 6 bytes [8 extra bits] len 8
                UUID (3) with 2 bytes [0 extra bits] len 3
                  PnP Information (0x1200)
                Unsigned Integer (1) with 2 bytes [0 extra bits] len 3
                  0x0103
            Attribute: Unknown (0x0200) [len 2]
              0x0103
            Attribute: Unknown (0x0201) [len 2]
              0x1d6b
            Attribute: Unknown (0x0202) [len 2]
              0x0246
            Attribute: Unknown (0x0203) [len 2]
              0x052b
            Attribute: Unknown (0x0204) [len 2]
              true
            Attribute: Unknown (0x0205) [len 2]
              0x0002
        Continuation state: 0
> ACL Data RX: Handle 12 flags 0x02 dlen 623                   [hci0] 16.162884
      Channel: 66 len 619 [PSM 1 mode 0] {chan 2}
      SDP: Service Search Attribute Response (0x07) tid 0 len 614
        Attribute bytes: 611
          Attribute list: [len 103] {position 0}
            Attribute: Service Record Handle (0x0000) [len 2]
              0x00010001
            Attribute: Service Class ID List (0x0001) [len 2]
              UUID (3) with 2 bytes [0 extra bits] len 3
                A/V Remote Control (0x110e)
              UUID (3) with 2 bytes [0 extra bits] len 3
                A/V Remote Control Controller (0x110f)
            Attribute: Protocol Descriptor List (0x0004) [len 2]
              Sequence (6) with 6 bytes [8 extra bits] len 8
                UUID (3) with 2 bytes [0 extra bits] len 3
                  L2CAP (0x0100)
                Unsigned Integer (1) with 2 bytes [0 extra bits] len 3
                  0x0017
              Sequence (6) with 6 bytes [8 extra bits] len 8
                UUID (3) with 2 bytes [0 extra bits] len 3
                  AVCTP (0x0017)
                Unsigned Integer (1) with 2 bytes [0 extra bits] len 3
                  0x0103
            Attribute: Browse Group List (0x0005) [len 2]
              UUID (3) with 2 bytes [0 extra bits] len 3
                Public Browse Root (0x1002)
            Attribute: Bluetooth Profile Descriptor List (0x0009) [len 2]
              Sequence (6) with 6 bytes [8 extra bits] len 8
                UUID (3) with 2 bytes [0 extra bits] len 3
                  A/V Remote Control (0x110e)
                Unsigned Integer (1) with 2 bytes [0 extra bits] len 3
                  0x0106
            Attribute: Additional Protocol Descriptor List (0x000d) [len 2]
              Sequence (6) with 16 bytes [8 extra bits] len 18
                Sequence (6) with 6 bytes [8 extra bits] len 8
                  UUID (3) with 2 bytes [0 extra bits] len 3
                    L2CAP (0x0100)
                  Unsigned Integer (1) with 2 bytes [0 extra bits] len 3
                    0x001b
                Sequence (6) with 6 bytes [8 extra bits] len 8
                  UUID (3) with 2 bytes [0 extra bits] len 3
                    AVCTP (0x0017)
                  Unsigned Integer (1) with 2 bytes [0 extra bits] len 3
                    0x0103
            Attribute: Unknown (0x0100) [len 2]
              AVRCP CT [len 8]
            Attribute: Unknown (0x0311) [len 2]
              0x004f
          Attribute list: [len 100] {position 1}
            Attribute: Service Record Handle (0x0000) [len 2]
              0x00010002
            Attribute: Service Class ID List (0x0001) [len 2]
              UUID (3) with 2 bytes [0 extra bits] len 3
                A/V Remote Control Target (0x110c)
            Attribute: Protocol Descriptor List (0x0004) [len 2]
              Sequence (6) with 6 bytes [8 extra bits] len 8
                UUID (3) with 2 bytes [0 extra bits] len 3
                  L2CAP (0x0100)
                Unsigned Integer (1) with 2 bytes [0 extra bits] len 3
                  0x0017
              Sequence (6) with 6 bytes [8 extra bits] len 8
                UUID (3) with 2 bytes [0 extra bits] len 3
                  AVCTP (0x0017)
                Unsigned Integer (1) with 2 bytes [0 extra bits] len 3
                  0x0103
            Attribute: Browse Group List (0x0005) [len 2]
              UUID (3) with 2 bytes [0 extra bits] len 3
                Public Browse Root (0x1002)
            Attribute: Bluetooth Profile Descriptor List (0x0009) [len 2]
              Sequence (6) with 6 bytes [8 extra bits] len 8
                UUID (3) with 2 bytes [0 extra bits] len 3
                  A/V Remote Control (0x110e)
                Unsigned Integer (1) with 2 bytes [0 extra bits] len 3
                  0x0105
            Attribute: Additional Protocol Descriptor List (0x000d) [len 2]
              Sequence (6) with 16 bytes [8 extra bits] len 18
                Sequence (6) with 6 bytes [8 extra bits] len 8
                  UUID (3) with 2 bytes [0 extra bits] len 3
                    L2CAP (0x0100)
                  Unsigned Integer (1) with 2 bytes [0 extra bits] len 3
                    0x001b
                Sequence (6) with 6 bytes [8 extra bits] len 8
                  UUID (3) with 2 bytes [0 extra bits] len 3
                    AVCTP (0x0017)
                  Unsigned Integer (1) with 2 bytes [0 extra bits] len 3
                    0x0103
            Attribute: Unknown (0x0100) [len 2]
              AVRCP TG [len 8]
            Attribute: Unknown (0x0311) [len 2]
              0x005f
          Attribute list: [len 81] {position 2}
            Attribute: Service Record Handle (0x0000) [len 2]
              0x00010003
            Attribute: Service Class ID List (0x0001) [len 2]
              UUID (3) with 2 bytes [0 extra bits] len 3
                Audio Source (0x110a)
            Attribute: Protocol Descriptor List (0x0004) [len 2]
              Sequence (6) with 6 bytes [8 extra bits] len 8
                UUID (3) with 2 bytes [0 extra bits] len 3
                  L2CAP (0x0100)
                Unsigned Integer (1) with 2 bytes [0 extra bits] len 3
                  0x0019
              Sequence (6) with 6 bytes [8 extra bits] len 8
                UUID (3) with 2 bytes [0 extra bits] len 3
                  AVDTP (0x0019)
                Unsigned Integer (1) with 2 bytes [0 extra bits] len 3
                  0x0103
            Attribute: Browse Group List (0x0005) [len 2]
              UUID (3) with 2 bytes [0 extra bits] len 3
                Public Browse Root (0x1002)
            Attribute: Bluetooth Profile Descriptor List (0x0009) [len 2]
              Sequence (6) with 6 bytes [8 extra bits] len 8
                UUID (3) with 2 bytes [0 extra bits] len 3
                  Advanced Audio Distribution (0x110d)
                Unsigned Integer (1) with 2 bytes [0 extra bits] len 3
                  0x0103
            Attribute: Unknown (0x0100) [len 2]
              Audio Source [len 12]
            Attribute: Unknown (0x0311) [len 2]
              0x000f
          Attribute list: [len 79] {position 3}
            Attribute: Service Record Handle (0x0000) [len 2]
              0x00010004
            Attribute: Service Class ID List (0x0001) [len 2]
              UUID (3) with 2 bytes [0 extra bits] len 3
                Audio Sink (0x110b)
            Attribute: Protocol Descriptor List (0x0004) [len 2]
              Sequence (6) with 6 bytes [8 extra bits] len 8
                UUID (3) with 2 bytes [0 extra bits] len 3
                  L2CAP (0x0100)
                Unsigned Integer (1) with 2 bytes [0 extra bits] len 3
                  0x0019
              Sequence (6) with 6 bytes [8 extra bits] len 8
                UUID (3) with 2 bytes [0 extra bits] len 3
                  AVDTP (0x0019)
                Unsigned Integer (1) with 2 bytes [0 extra bits] len 3
                  0x0103
            Attribute: Browse Group List (0x0005) [len 2]
              UUID (3) with 2 bytes [0 extra bits] len 3
                Public Browse Root (0x1002)
            Attribute: Bluetooth Profile Descriptor List (0x0009) [len 2]
              Sequence (6) with 6 bytes [8 extra bits] len 8
                UUID (3) with 2 bytes [0 extra bits] len 3
                  Advanced Audio Distribution (0x110d)
                Unsigned Integer (1) with 2 bytes [0 extra bits] len 3
                  0x0103
            Attribute: Unknown (0x0100) [len 2]
              Audio Sink [len 10]
            Attribute: Unknown (0x0311) [len 2]
              0x000f
          Attribute list: [len 83] {position 4}
            Attribute: Service Record Handle (0x0000) [len 2]
              0x00010005
            Attribute: Service Class ID List (0x0001) [len 2]
              UUID (3) with 2 bytes [0 extra bits] len 3
                Headset AG (0x1112)
              UUID (3) with 2 bytes [0 extra bits] len 3
                Generic Audio (0x1203)
            Attribute: Protocol Descriptor List (0x0004) [len 2]
              Sequence (6) with 3 bytes [8 extra bits] len 5
                UUID (3) with 2 bytes [0 extra bits] len 3
                  L2CAP (0x0100)
              Sequence (6) with 5 bytes [8 extra bits] len 7
                UUID (3) with 2 bytes [0 extra bits] len 3
                  RFCOMM (0x0003)
                Unsigned Integer (1) with 1 byte [0 extra bits] len 2
                  0x0c
            Attribute: Browse Group List (0x0005) [len 2]
              UUID (3) with 2 bytes [0 extra bits] len 3
                Public Browse Root (0x1002)
            Attribute: Bluetooth Profile Descriptor List (0x0009) [len 2]
              Sequence (6) with 6 bytes [8 extra bits] len 8
                UUID (3) with 2 bytes [0 extra bits] len 3
                  Headset (0x1108)
                Unsigned Integer (1) with 2 bytes [0 extra bits] len 3
                  0x0102
            Attribute: Unknown (0x0100) [len 2]
              Headset Voice gateway [len 21]
          Attribute list: [len 150] {position 5}
            Attribute: Service Record Handle (0x0000) [len 2]
              0x00010006
            Attribute: Service Class ID List (0x0001) [len 2]
              UUID (3) with 16 bytes [0 extra bits] len 17
                00001108-0000-1000-8000-00805f9b34fb
                Headset
            Attribute: Protocol Descriptor List (0x0004) [len 2]
              Sequence (6) with 3 bytes [8 extra bits] len 5
                UUID (3) with 2 bytes [0 extra bits] len 3
                  L2CAP (0x0100)
              Sequence (6) with 5 bytes [8 extra bits] len 7
                UUID (3) with 2 bytes [0 extra bits] len 3
                  RFCOMM (0x0003)
                Unsigned Integer (1) with 1 byte [0 extra bits] len 2
                  0x03
            Attribute: Browse Group List (0x0005) [len 2]
              UUID (3) with 2 bytes [0 extra bits] len 3
                Public Browse Root (0x1002)
            Attribute: Bluetooth Profile Descriptor List (0x0009) [len 2]
              Sequence (6) with 20 bytes [8 extra bits] len 22
                UUID (3) with 16 bytes [0 extra bits] len 17
                  00001108-0000-1000-8000-00805f9b34fb
                  Headset
                Unsigned Integer (1) with 2 bytes [0 extra bits] len 3
                  0x0102
            Attribute: Unknown (0x0100) [len 2]
              :1.35/Profile/HSPHSProfile/00001108-0000-1000-8000-00805f9b34fb [len 63]
        Continuation state: 0
> HCI Event: Number of Completed Packets (0x13) plen 5         [hci0] 16.169831
        Num handles: 1
        Handle: 12
        Count: 2
< ACL Data TX: Handle 12 flags 0x00 dlen 24                    [hci0] 16.193237
      Channel: 66 len 20 [PSM 1 mode 0] {chan 2}
      SDP: Service Search Attribute Request (0x06) tid 1 len 15
        Search pattern: [len 5]
          Sequence (6) with 3 bytes [8 extra bits] len 5
            UUID (3) with 2 bytes [0 extra bits] len 3
              PnP Information (0x1200)
        Max record count: 65535
        Attribute list: [len 7]
          Sequence (6) with 5 bytes [8 extra bits] len 7
            Unsigned Integer (1) with 4 bytes [0 extra bits] len 5
              0x0000ffff
        Continuation state: 0
> ACL Data RX: Handle 12 flags 0x02 dlen 88                    [hci0] 16.216445
      Channel: 66 len 84 [PSM 1 mode 0] {chan 2}
      SDP: Service Search Attribute Response (0x07) tid 1 len 79
        Attribute bytes: 76
          Attribute list: [len 72] {position 0}
            Attribute: Service Record Handle (0x0000) [len 2]
              0x00010000
            Attribute: Service Class ID List (0x0001) [len 2]
              UUID (3) with 2 bytes [0 extra bits] len 3
                PnP Information (0x1200)
            Attribute: Browse Group List (0x0005) [len 2]
              UUID (3) with 2 bytes [0 extra bits] len 3
                Public Browse Root (0x1002)
            Attribute: Bluetooth Profile Descriptor List (0x0009) [len 2]
              Sequence (6) with 6 bytes [8 extra bits] len 8
                UUID (3) with 2 bytes [0 extra bits] len 3
                  PnP Information (0x1200)
                Unsigned Integer (1) with 2 bytes [0 extra bits] len 3
                  0x0103
            Attribute: Unknown (0x0200) [len 2]
              0x0103
            Attribute: Unknown (0x0201) [len 2]
              0x1d6b
            Attribute: Unknown (0x0202) [len 2]
              0x0246
            Attribute: Unknown (0x0203) [len 2]
              0x0530
            Attribute: Unknown (0x0204) [len 2]
              true
            Attribute: Unknown (0x0205) [len 2]
              0x0002
        Continuation state: 0
> HCI Event: Number of Completed Packets (0x13) plen 5         [hci0] 16.458415
        Num handles: 1
        Handle: 12
        Count: 1
< ACL Data TX: Handle 12 flags 0x00 dlen 8                     [hci0] 17.169688
      Channel: 64 len 4 [PSM 3 mode 0] {chan 0}
      RFCOMM: Disconnect (DISC) (0x43)
         Address: 0x01 cr 0 dlci 0x00
         Control: 0x53 poll/final 1
         Length: 0
         FCS: 0x9c
> ACL Data RX: Handle 12 flags 0x02 dlen 8                     [hci0] 17.177396
      Channel: 64 len 4 [PSM 3 mode 0] {chan 0}
      RFCOMM: Unnumbered Ack (UA) (0x63)
         Address: 0x01 cr 0 dlci 0x00
         Control: 0x73 poll/final 1
         Length: 0
         FCS: 0xb6
< ACL Data TX: Handle 12 flags 0x00 dlen 12                    [hci0] 17.177584
      L2CAP: Disconnection Request (0x06) ident 7 len 4
        Destination CID: 64
        Source CID: 64
> ACL Data RX: Handle 12 flags 0x02 dlen 12                    [hci0] 17.178693
      L2CAP: Disconnection Request (0x06) ident 8 len 4
        Destination CID: 64
        Source CID: 64
< ACL Data TX: Handle 12 flags 0x00 dlen 12                    [hci0] 17.178853
      L2CAP: Disconnection Response (0x07) ident 8 len 4
        Destination CID: 64
        Source CID: 64
> HCI Event: Number of Completed Packets (0x13) plen 5         [hci0] 17.181286
        Num handles: 1
        Handle: 12
        Count: 2
> ACL Data RX: Handle 12 flags 0x02 dlen 12                    [hci0] 17.183656
      L2CAP: Disconnection Response (0x07) ident 7 len 4
        Destination CID: 64
        Source CID: 64
> HCI Event: Number of Completed Packets (0x13) plen 5         [hci0] 17.333385
        Num handles: 1
        Handle: 12
        Count: 1
> ACL Data RX: Handle 12 flags 0x02 dlen 12                    [hci0] 18.108687
      L2CAP: Disconnection Request (0x06) ident 9 len 4
        Destination CID: 65
        Source CID: 65
< ACL Data TX: Handle 12 flags 0x00 dlen 12                    [hci0] 18.108862
      L2CAP: Disconnection Response (0x07) ident 9 len 4
        Destination CID: 65
        Source CID: 65
< ACL Data TX: Handle 12 flags 0x00 dlen 12                    [hci0] 18.130270
      L2CAP: Disconnection Request (0x06) ident 8 len 4
        Destination CID: 66
        Source CID: 66
> HCI Event: Number of Completed Packets (0x13) plen 5         [hci0] 18.139980
        Num handles: 1
        Handle: 12
        Count: 2
> ACL Data RX: Handle 12 flags 0x02 dlen 12                    [hci0] 18.142402
      L2CAP: Disconnection Response (0x07) ident 8 len 4
        Destination CID: 66
        Source CID: 66
> HCI Event: Disconnect Complete (0x05) plen 4                 [hci0] 20.347336
        Status: Success (0x00)
        Handle: 12
        Reason: Remote User Terminated Connection (0x13)
@ MGMT Event: Device Disconnected (0x000c) plen 8     {0x0002} [hci0] 20.347437
        BR/EDR Address: D4:6D:6D:D9:B3:F3 (OUI D4-6D-6D)
        Reason: Connection terminated by remote host (0x03)
@ MGMT Event: Device Disconnected (0x000c) plen 8     {0x0001} [hci0] 20.347437
        BR/EDR Address: D4:6D:6D:D9:B3:F3 (OUI D4-6D-6D)
        Reason: Connection terminated by remote host (0x03)
@ MGMT Command: Unpair Device (0x001b) plen 8         {0x0001} [hci0] 20.378300
        BR/EDR Address: D4:6D:6D:D9:B3:F3 (OUI D4-6D-6D)
        Disconnect: Enabled (0x01)
@ MGMT Event: Command Complete (0x0001) plen 10       {0x0001} [hci0] 20.390173
      Unpair Device (0x001b) plen 7
        Status: Not Paired (0x06)
        BR/EDR Address: D4:6D:6D:D9:B3:F3 (OUI D4-6D-6D)
